State,State Funding Types,State Prioritization,Facility Assessment Requirements,Equity Measures
Texas,"The state guarantees bonds and provides assistance through tax rate equalization, guaranteeing up to $0.29 per $100 of assessed value, and debt service assistance, providing a guaranteed yield of $35 per penny of tax effort per student.",Not applicable. ,No requirement. ,"Debt service funding is scaled to per student district property value, as well as the size of debt service payments. "
Utah,The state provides a guaranteed level of foundation funding for capital projects based on districts’ property tax effort and property tax yield per student. Additional funding is available for small school districts. The state also provides capital outlay funding to school districts experiencing net enrollment increases.,Not applicable.,Districts are required to conduct assessments.,Districts with less property tax wealth receive more state funding.
Vermont,"The school construction aid program is currently suspended, and the state funds only approved emergency projects and projects currently under way. The state recently enacted a law that charges the state superintendent to assess all school facilities and hire a consultant to design a funding process for Vermont.","The state has no priorities, as districts must currently fund all facilities projects. ",No requirement. ,Not applicable. 
Virginia,"The state offers bond financing assistance, and a small program, the Literary Fund, provides low-interest loans for eligible districts, with subsidies based on district ability to pay education costs. ",Not applicable.,No requirement. ,"Literary Fund ability to pay is based on property value (weighted 50 percent), adjusted gross income (40 percent), and taxable retail sales (10 percent). "
Washington,"The state offers two main programs for capital project funding: (1) the School Construction Assistance Program, which requires a match of local funding with the state’s share based on the school district’s property value per student compared with the statewide average; and (2) the Small School District and State-Tribal Education Compact Modernization grants, which fully fund projects less than $5 million for districts enrolling less than 1,000 students. ","The state uses a points system to rank projects. Projects to address enrollment growth are scored out of 90 points, with more points based on share of current and projected unhoused students and duration of need. Modernization projects are scored out of 75 points for building condition and health and safety. Both types of projects are scored on type of space, local priority, availability of local or private funding, and use of a modified school calendar. The Small School District and State-Tribal Education Compact Modernization grants have priorities determined by a state advisory with school facility experience. ","The state has requirements, with a grant provided to districts to conduct an assessment every six year. Every six years, a district is entitled to apply for a study and survey grant, which is state funding for a planning document. The study and survey grant pays for a district to hire a consultant to perform an inventory and condition assessment of each of the instructional buildings. The funding pays for long-term planning and educational specifications.","The state’s share is based on a district’s ability to generate wealth from property taxes, with additional state assistance available for mitigating racially imbalanced facilities. Additional points are given to districts that have a high participation in free and reduced-price lunch programs. "
West Virginia,"The state provides grants for capital projects, with amounts determined by current and projected enrollment multiplied by a square footage allowance per student, which varies by level or school.","The state has no priorities, but proposals for funding must describe how facilities will meet criteria around health and safety, economies of scale, student travel time, regional planning, curricular improvement, educational innovation, space, local bond history, preventive maintenance, and efficient use of funding.",Districts are required to conduct assessments every 10 years.,Not applicable.
Wisconsin,The state provides no funding for school capital projects.,Not applicable. ,No requirement. ,Not applicable.
Wyoming,"The state provides grants that fund the full amount of every successful major capital project application. Grant applications are considered via a combined score of a facility condition assessment, educational functionality, and a prioritized needs index identifying the most critical projects across the state. ","The state prioritizes projected school and district capacity (55 percent of the grant application score) and the facility condition index (45 percent). Facility condition includes an assessment of structure, interiors, services, equipment, special facilities, site, and accessibility.",The state conducts assessments.,Not applicable.
